{
  "schemaVersion": "0.1",
  "asOf": "2026-07-24",
  "summary": {
    "nodeCount": 264,
    "edgeCount": 126,
    "nodeTypeCounts": {
      "event": 18,
      "investor": 2,
      "listed_company": 10,
      "ma_project": 25,
      "person": 52,
      "preipo_enterprise": 81,
      "private_manager": 22,
      "shareholder": 51,
      "soe_group": 3
    },
    "relationTypeCounts": {
      "executive": 52,
      "has_event": 18,
      "invested_in": 2,
      "linked_ma_project": 3,
      "shareholder_of": 51
    }
  },
  "nodes": [
    {
      "nodeId": "evt-20260709-kanghui-related-project",
      "nodeType": "event",
      "name": "康惠股份子公司拟承接5,059.92万元关联项目",
      "status": "action_window",
      "channel": "listed",
      "sourceScope": "dashboard"
    },
    {
      "nodeId": "evt-20260710-machinery-meeting",
      "nodeType": "event",
      "name": "建设机械临时股东会将审议核销与薪酬事项",
      "status": "action_window",
      "channel": "listed",
      "sourceScope": "dashboard"
    },
    {
      "nodeId": "evt-20260707-rainbow-ma",
      "nodeType": "event",
      "name": "彩虹股份拟收购虹阳显示33.4204%少数股权",
      "status": "action_window",
      "channel": "ma",
      "sourceScope": "dashboard"
    },
    {
      "nodeId": "evt-20260709-rainbow-forecast",
      "nodeType": "event",
      "name": "彩虹股份预计上半年归母净利润同比下降75.66%-78.76%",
      "status": "risk",
      "channel": "listed",
      "sourceScope": "dashboard"
    },
    {
      "nodeId": "evt-20260709-aikosai-inquiry",
      "nodeType": "event",
      "name": "爱科赛博年报问询回复披露亏损与内控整改",
      "status": "risk",
      "channel": "listed",
      "sourceScope": "dashboard"
    },
    {
      "nodeId": "evt-20260710-panlong-catalogue",
      "nodeType": "event",
      "name": "盘龙药业两项产品进入国家基本药物目录",
      "status": "watch",
      "channel": "listed",
      "sourceScope": "dashboard"
    },
    {
      "nodeId": "evt-20260708-luge-product",
      "nodeType": "event",
      "name": "禄格永兴2号完成私募证券基金备案",
      "status": "active",
      "channel": "private_fund",
      "sourceScope": "dashboard"
    },
    {
      "nodeId": "evt-20260709-meichang-forecast",
      "nodeType": "event",
      "name": "美畅股份预计上半年归母净利同比增长248%-272%",
      "status": "watch",
      "channel": "listed",
      "sourceScope": "dashboard"
    },
    {
      "nodeId": "evt-20260302-jiatai-cancel",
      "nodeType": "event",
      "name": "西安嘉泰基金管理有限公司主动注销",
      "status": "completed",
      "channel": "private_fund",
      "sourceScope": "dashboard"
    },
    {
      "nodeId": "evt-20260710-bank-litigation",
      "nodeType": "event",
      "name": "西安银行7.3亿元借款纠纷进入执行受理",
      "status": "progressing",
      "channel": "listed",
      "sourceScope": "dashboard"
    },
    {
      "nodeId": "evt-20260710-bank-director",
      "nodeType": "event",
      "name": "西安银行董事侯博任职资格获监管核准",
      "status": "progressing",
      "channel": "listed",
      "sourceScope": "dashboard"
    },
    {
      "nodeId": "evt-20260710-energy-reduction",
      "nodeType": "event",
      "name": "长安汇通拟减持陕西能源不超过2%股份",
      "status": "action_window",
      "channel": "listed",
      "sourceScope": "dashboard"
    },
    {
      "nodeId": "evt-20260709-shaanxi-construction-dividend",
      "nodeType": "event",
      "name": "陕建股份实施2025年度现金分红",
      "status": "action_window",
      "channel": "listed",
      "sourceScope": "dashboard"
    },
    {
      "nodeId": "evt-20260709-water-vpp",
      "nodeType": "event",
      "name": "陕西水务发展签约略阳城市级虚拟电厂项目",
      "status": "watch",
      "channel": "soe",
      "sourceScope": "dashboard"
    },
    {
      "nodeId": "evt-20260617-social-fund",
      "nodeType": "event",
      "name": "陕西社保科创基金在西安签约",
      "status": "watch",
      "channel": "equity_financing",
      "sourceScope": "dashboard"
    },
    {
      "nodeId": "evt-20260121-jinzi-tender",
      "nodeType": "event",
      "name": "陕西金资基金科创债主承销商项目已完成招标",
      "status": "completed",
      "channel": "tender",
      "sourceScope": "dashboard"
    },
    {
      "nodeId": "evt-20260611-maikeaote-hearing",
      "nodeType": "event",
      "name": "陕西麦科奥特完成港交所主板上市",
      "status": "completed",
      "channel": "equity_financing",
      "sourceScope": "dashboard"
    },
    {
      "nodeId": "evt-20260627-shaangu-ma",
      "nodeType": "event",
      "name": "陕鼓动力筹划收购秦风气体36.06%少数股权",
      "status": "progressing",
      "channel": "ma",
      "sourceScope": "dashboard"
    },
    {
      "nodeId": "investor-29d5f1f2288240",
      "nodeType": "investor",
      "name": "西安高新金融控股集团",
      "sourceScope": "official_investor"
    },
    {
      "nodeId": "investor-9a258004e3757f",
      "nodeType": "investor",
      "name": "陕西省科创母基金直投份额",
      "sourceScope": "official_investor"
    },
    {
      "nodeId": "ent-kanghui",
      "nodeType": "listed_company",
      "name": "康惠股份",
      "region": "陕西",
      "securityCode": "603139.SH",
      "sourceScope": "dashboard"
    },
    {
      "nodeId": "ent-construction-machinery",
      "nodeType": "listed_company",
      "name": "建设机械",
      "region": "陕西",
      "securityCode": "600984.SH",
      "sourceScope": "dashboard"
    },
    {
      "nodeId": "ent-rainbow",
      "nodeType": "listed_company",
      "name": "彩虹股份",
      "region": "陕西",
      "securityCode": "600707.SH",
      "sourceScope": "dashboard"
    },
    {
      "nodeId": "ent-aikosai",
      "nodeType": "listed_company",
      "name": "爱科赛博",
      "region": "陕西",
      "securityCode": "688719.SH",
      "sourceScope": "dashboard"
    },
    {
      "nodeId": "ent-panlong",
      "nodeType": "listed_company",
      "name": "盘龙药业",
      "region": "陕西",
      "securityCode": "002864.SZ",
      "sourceScope": "dashboard"
    },
    {
      "nodeId": "ent-meichang",
      "nodeType": "listed_company",
      "name": "美畅股份",
      "region": "陕西",
      "securityCode": "300861.SZ",
      "sourceScope": "dashboard"
    },
    {
      "nodeId": "ent-xian-bank",
      "nodeType": "listed_company",
      "name": "西安银行",
      "region": "陕西",
      "securityCode": "600928.SH",
      "sourceScope": "dashboard"
    },
    {
      "nodeId": "ent-shaanxi-construction",
      "nodeType": "listed_company",
      "name": "陕建股份",
      "region": "陕西",
      "securityCode": "600248.SH",
      "sourceScope": "dashboard"
    },
    {
      "nodeId": "ent-shaanxi-energy",
      "nodeType": "listed_company",
      "name": "陕西能源",
      "region": "陕西",
      "securityCode": "001286.SZ",
      "sourceScope": "dashboard"
    },
    {
      "nodeId": "ent-shaangu",
      "nodeType": "listed_company",
      "name": "陕鼓动力",
      "region": "陕西",
      "securityCode": "601369.SH",
      "sourceScope": "dashboard"
    },
    {
      "nodeId": "ma-3df45d2a93e2c022",
      "nodeType": "ma_project",
      "name": "世纪金花出售西安亿鑫物业100%股权",
      "stage": "in_progress",
      "sourceStatus": "needs_source_backfill",
      "sourceScope": "ma_project"
    },
    {
      "nodeId": "ma-40f1fe5672e1af96",
      "nodeType": "ma_project",
      "name": "京投发展筹划收购西安奇芯光电股权",
      "stage": "planning",
      "sourceStatus": "needs_source_backfill",
      "sourceScope": "ma_project"
    },
    {
      "nodeId": "ma-28acc60627a1958e",
      "nodeType": "ma_project",
      "name": "供销大集收购国投农产品60%股权",
      "stage": "completed",
      "sourceStatus": "needs_source_backfill",
      "sourceScope": "ma_project"
    },
    {
      "nodeId": "ma-08946af858afaff1",
      "nodeType": "ma_project",
      "name": "北方长龙收购顺义科技51%股权",
      "stage": "signed_or_approved",
      "sourceStatus": "needs_source_backfill",
      "sourceScope": "ma_project"
    },
    {
      "nodeId": "ma-087d7b42a43da903",
      "nodeType": "ma_project",
      "name": "华天科技收购华羿微电100%股份",
      "stage": "in_progress",
      "sourceStatus": "needs_source_backfill",
      "sourceScope": "ma_project"
    },
    {
      "nodeId": "ma-e5d61ffd5a2aa72f",
      "nodeType": "ma_project",
      "name": "大唐黄金收购宁陕两家项目公司",
      "stage": "signed_or_approved",
      "sourceStatus": "needs_source_backfill",
      "sourceScope": "ma_project"
    },
    {
      "nodeId": "ma-50e68cae8cfcd070",
      "nodeType": "ma_project",
      "name": "天地源挂牌转让深宝水电51%股权",
      "stage": "in_progress",
      "sourceStatus": "needs_source_backfill",
      "sourceScope": "ma_project"
    },
    {
      "nodeId": "ma-b742611082c3d76b",
      "nodeType": "ma_project",
      "name": "天地源筹划出售房地产开发资产及负债",
      "stage": "planning",
      "sourceStatus": "needs_source_backfill",
      "sourceScope": "ma_project"
    },
    {
      "nodeId": "ma-rainbow-hongyang-minority-2026",
      "nodeType": "ma_project",
      "name": "彩虹股份拟收购虹阳显示33.4204%少数股权",
      "stage": "signed_or_approved",
      "sourceStatus": "official",
      "sourceScope": "ma_project"
    },
    {
      "nodeId": "ma-83a64ad6de4fa755",
      "nodeType": "ma_project",
      "name": "恒天海龙拟收购群健航空不少于40%股权",
      "stage": "planning",
      "sourceStatus": "needs_source_backfill",
      "sourceScope": "ma_project"
    },
    {
      "nodeId": "ma-9d3063c2c32f9b55",
      "nodeType": "ma_project",
      "name": "招商局置地体系内收购西安项目公司",
      "stage": "signed_or_approved",
      "sourceStatus": "needs_source_backfill",
      "sourceScope": "ma_project"
    },
    {
      "nodeId": "ma-cef51041540e02c8",
      "nodeType": "ma_project",
      "name": "汉朔科技控股西安超嗨网络",
      "stage": "completed",
      "sourceStatus": "needs_source_backfill",
      "sourceScope": "ma_project"
    },
    {
      "nodeId": "ma-dd6b657107378ce4",
      "nodeType": "ma_project",
      "name": "炼石航空收购并增资成都天科航空",
      "stage": "signed_or_approved",
      "sourceStatus": "needs_source_backfill",
      "sourceScope": "ma_project"
    },
    {
      "nodeId": "ma-9e1bf53772f2b2e4",
      "nodeType": "ma_project",
      "name": "紫光国芯完成15%股份协议转让",
      "stage": "completed",
      "sourceStatus": "needs_source_backfill",
      "sourceScope": "ma_project"
    },
    {
      "nodeId": "ma-1809b8def9c6e061",
      "nodeType": "ma_project",